METODOLOGIA,,,,
Categoria,#,Descrição do Problema / Sintoma no Ponto A,Descrição da Transformação / Resultado Final (Ponto B),OBS
Martech (Tecnologia),1,"CRM usado apenas como lista de contatos, sem nenhuma automação.","CRM 100% automatizado, com réguas de nutrição ativas para cada etapa do funil.",
,2,Sem integração direta entre anúncios (Meta/Google) e o CRM (entrada manual).,Integração nativa (API) entre Meta/Google e CRM: zero perda de dados.,
,3,Pixel e API de Conversão mal configurados; o algoritmo não aprende quem compra.,"Pixel e API de Conversão treinados, trazendo leads com perfil de comprador real.",
,4,Falta de rastreamento (UTMs) para identificar qual anúncio gerou a venda.,Atribuição de vendas precisa: o dono sabe o ROI de cada centavo investido.,
,5,Base de leads fragmentada em planilhas de Excel com diferentes corretores.,"Base de dados unificada, higienizada e pronta para novas campanhas.",
,6,Site institucional lento e não otimizado para conversão de leads.,Landing Pages de alta conversão com testes A/B rodando continuamente.,
,7,Ausência de Dashboards de BI (Looker/PowerBI) para visualização de dados.,Dashboard de BI em tempo real na TV da sala da diretoria com métricas vivas.,
,8,Subutilização de softwares caros por falta de treinamento da equipe.,Equipe comercial domina as ferramentas de Martech e as usa para vender mais.,
,9,Leads duplicados no sistema gerando confusão no atendimento comercial.,Deduplicação automática de leads: atendimento limpo e sem confusão.,
,10,"Falta de uma ""Roleta de Leads"" automática para distribuição justa.",Sistema de distribuição de leads (Roleta) inteligente por performance de corretor.,
Smarketing (Mkt + Vendas),11,"Marketing foca em ""Lead Barato"" e Vendas reclama da ""Baixa Qualidade"".",Marketing foca em Custo por Venda e o Vendas foca em conversão de MQL.,
,12,Inexistência de uma definição clara de MQL (Lead Qualificado pelo Marketing).,Definição clara e consensual de Lead Qualificado (SQL) entre os times.,
,13,Tempo de resposta (Time to Response) ao lead superior a 24 horas.,Primeiro contato com o lead ocorre em menos de 5 minutos (velocidade máxima).,
,14,Ausência de um SLA (Acordo de Nível de Serviço) entre os gestores.,"SLA assinado e respeitado: Marketing entrega qualidade, Vendas entrega esforço.",
,15,Falta de feedback do Comercial para o Marketing sobre a performance do lead.,Reuniões semanais de Smarketing para ajuste fino de discurso e criativos.,
,16,Corretores descartam leads na primeira tentativa de contato frustrada.,"Corretores executam o processo de ""cadência de contatos"" (follow-up) rigoroso.",
,17,"Desconhecimento da taxa de conversão de ""Visita"" para ""Proposta"".",Visibilidade total da conversão: do clique no anúncio à escritura assinada.,
,18,Roteiro de vendas (Script) desconectado da promessa dos anúncios.,Script de vendas validado e em constante evolução baseado nos feedbacks do CRM.,
,19,"Time comercial reativo, sem cultura de prospecção na base de dados.","Time comercial treinado em ""Social Selling"" e uso de dados para fechar negócios.",
,20,"Reuniões de resultado focadas em ""achar culpados"" em vez de ajustar o funil.",Ambiente de colaboração onde Marketing e Vendas jogam no mesmo time.,
Processos e Gestão,21,"Investimento em marketing decidido pelo ""feeling"" do dono, sem dados.",Verba de marketing alocada com base em dados históricos de conversão.,
,22,Desconhecimento do CAC (Custo de Aquisição de Cliente) real por projeto.,Domínio total do CAC: a empresa sabe quanto pode pagar por cada cliente.,
,23,Régua de relacionamento (nutrição de leads) inexistente ou 100% manual.,Nutrição automática de leads de longo prazo (quem vai comprar daqui a 1 ano).,
,24,"Processo de reserva de unidades burocrático, lento e analógico.",Reserva de unidades e assinatura de contratos 100% digital e rápida.,
,25,Ausência de Lead Scoring (pontuação automática de interesse do lead).,Lead Scoring ativo: o corretor sabe quem priorizar no início do dia.,
,26,Imobiliárias parceiras não alimentam o CRM da loteadora (falta de controle).,Imobiliárias parceiras integradas ao ecossistema de dados da loteadora.,
,27,Perda do histórico do cliente quando um corretor sai da empresa.,"Segurança da informação: histórico do cliente pertence à empresa, não ao corretor.",
,28,"Não existe processo para recuperação de ""leads perdidos"" (repescagem).","Máquina de recuperação de leads perdidos gerando vendas ""gratuitas"" na base.",
,29,Empresa não realiza Testes A/B em páginas ou criativos de anúncios.,Processo de lançamento baseado em experimentos validados previamente.,case interessante de Itaqui
,30,"Falta de estratégia de ""Demanda Represada"" pré-lançamento.","Estratégia de ""Demanda Represada"" digital garante 30% de vendas no dia 1.","Trazer média CAY, SBY, IDA,"
Sintomas de Negócio,31,"Volume alto de leads entrando, mas o VGV vendido está estagnado.",VGV (Valor Geral de Vendas) esgotado dentro ou antes do prazo previsto.,
,32,Sensação nítida de que o budget de marketing está sendo queimado.,"Marketing visto como investimento de alto retorno, não como centro de custo.",
,33,"Dependência perigosa de 1 ou 2 ""corretores talentosos"" para bater metas.",Processo de vendas independente: qualquer corretor novo performa rápido.,
,34,"Estande de vendas vazio durante a semana, apesar do tráfego pago.",Estande de vendas recebe visitas qualificadas e agendadas previamente.,
,35,Excesso de reclamações de clientes sobre demora no primeiro contato.,Experiência do cliente impecável desde o primeiro clique até a entrega.,sem histórico real
,36,"Impossibilidade de provar o ROI de ações offline (outdoors, rádio).",Rastreabilidade total: o offline e o online trabalham em sinergia (Omnichannel).,
,37,Custo por Lead (CPL) subindo mês a mês sem explicação clara.,"Escala previsível: se dobrar o investimento, a empresa sabe quanto vai vender.",
,38,Baixa taxa de indicação (MGM) por falta de processo tecnológico no pós-venda.,Programa de indicações (MGM) gera 10% a 20% das vendas de forma orgânica.,sem histórico real
,39,"Estoque de unidades remanescentes (""encalhadas"") crescendo.",Zero estoque encalhado: estratégias de repescagem liquidam os remanescentes.,em construção
,40,Insegurança e medo constante de que o próximo lançamento fracasse.,Diretoria segura e confiante para adquirir novos terrenos e expandir.,
Estratégia e Cultura,41,"Comunicação genérica (""Vem morar bem"") em vez de segmentada por dados.",Comunicação ultra-segmentada por persona (Investidor vs. Morador).,
,42,Inteligência de dados ignorada na hora de escolher o próximo terreno.,Dados de mercado e de funil orientam a concepção dos próximos produtos.,
,43,Falta de monitoramento tecnológico sobre os anúncios da concorrência.,Monitoramento constante de mercado permite antecipar movimentos de rivais.,
,44,Branding e Performance são tratados como mundos separados e desconexos.,"Marca da incorporadora é percebida como moderna, tecnológica e confiável.",
,45,Uso excessivo de fotos de banco de imagens em vez de provas sociais reais.,Uso estratégico de depoimentos reais e prova social em toda a jornada.,
,46,"Base de clientes antigos é tratada como ""arquivo morto"".",Base de clientes (Assets) é o maior motor de vendas para novos lançamentos.,depende região
,47,Inexistência de uma cultura Data-Driven (decisões baseadas em dados).,"Decisões são tomadas em segundos através de dados, não de discussões.",
,48,"Comercial foca em ""preço"" porque o marketing não gerou ""valor"".",Valor percebido do produto permite margens de lucro acima da média.,
,49,"Refém de portais imobiliários caros, sem geração de demanda própria.","Geração de demanda própria, reduzindo dependência de portais externos.",
,50,Dono sobrecarregado mediando conflitos operacionais entre agência e equipe.,"Dono foca no estratégico e na expansão, com a máquina de vendas no automático.",← transição atual ET/CT